{
  "id": "rg350",
  "identite": {
    "nom": "RG350",
    "fabricant": "Anbernic",
    "alias": []
  },
  "materiel": {
    "soc": "Ingenic JZ4770",
    "architecture": "MIPS"
  },
  "os": {
    "type": "OpenDingux"
  },
  "options": {
    "frontend": [
      {
        "nom": "EmulationStation",
        "description": "EmulationStation for the RG350. App with default filesystem and config files.",
        "licence": "non_detectee",
        "source_url": "https://github.com/ManuelSch81/RG350-EmulationStation_configured",
        "licence_a_verifier": true
      }
    ],
    "systeme_cfw": [],
    "firmware_origine": [],
    "mises_a_jour": []
  },
  "liens_officiels": [],
  "licences": [],
  "sources": [
    {
      "url": "https://github.com/Ninoh-FOX/toolchain",
      "type": "github"
    },
    {
      "url": "https://github.com/ManuelSch81/RG350-EmulationStation_configured",
      "type": "github"
    }
  ],
  "recherche_web": false,
  "sources_collectees": true,
  "statut": "non_verifie",
  "signalements": 0,
  "date_verification": null
}